<?xml version="1.0" encoding="UTF-8"?>
<UIPart id="main_um" jquery="0" xmlns="http://com.founer.xap/schema/lui" xmlns:xsi="http://www.w3.org/2001/XMLSchema-instance" xsi:schemaLocation="http://com.founer.xap/schema/lui http://com.founer.xap/schema/lui/layout.xsd">
    <FlowVLayout id="flowvlayout3359" widgetId="main">
        <FlowVPanel id="panelv03359" widgetId="main">
            <Grid height="100%" id="winlist_grid" left="0" position="relative" top="0" widgetId="main" width="100%">
            </Grid>
        </FlowVPanel>
        <FlowVPanel height="46" id="panelv23359" widgetId="main">
            <FlowHLayout id="flowhlayout6804" isAutoFill="false" widgetId="main">
                <FlowHPanel id="panelh06776" widgetId="main">
                </FlowHPanel>
                <FlowHPanel id="panelh16776" topPadding="10" widgetId="main" width="100">
                    <Button height="24" id="btn_ok" left="0" position="relative" top="0" widgetId="main" width="64">
                    </Button>
                </FlowHPanel>
                <FlowHPanel id="flowhpanel18202" topPadding="10" widgetId="main" width="100">
                    <Button height="24" id="btn_cancel" left="0" position="relative" top="0" widgetId="main" width="64">
                    </Button>
                </FlowHPanel>
                <FlowHPanel id="panelh26776" widgetId="main" width="10">
                </FlowHPanel>
            </FlowHLayout>
        </FlowVPanel>
    </FlowVLayout>
</UIPart>
